{
  "customer_name": "Auto & General Insurance Services Pty",
  "business_name": "",
  "first_name": "Auto",
  "last_name": "& General Insurance Services Pty",
  "address": "28 HILLVIEW AVENUE, Newtown, QLD 4350",
  "address1": "28 HILLVIEW AVENUE",
  "address2": "",
  "city": "Newtown",
  "state": "QLD",
  "zip_code": "4350",
  "country": "Australia",
  "phone": "0409251687",
  "mobile": "",
  "work_phone": "",
  "home_phone": "",
  "email": "accounts@profilebuildgroup.com.au",
  "customer_type": "Builders",
  "extra_phones": [
    "0736380304",
    "97783979",
    "15011120"
  ],
  "po_number": "PBG-18191-18039",
  "scope_of_work": "PBG-18191-18039\nFlooring\nMaterial\nSUNROOM -INTERNAL\nRemove & Replace Flooring - Laminate\n14/m2\nRemove & relace existing hardboard - existing hardboard has not be installed correctly\nExisting hardboard has not be installed correctly. New hardboard to be nailed & glued\n1/ea",
  "dollar_value": 2959.0,
  "job_number": "Paul White 0427 970 055",
  "actual_job_number": "PBG-18191",
  "supervisor_name": "Paul White",
  "supervisor_mobile": "0427 970 055",
  "supervisor_email": "",
  "description_of_works": "PBG-18191-18039\nFlooring\nMaterial\nSUNROOM -INTERNAL\nRemove & Replace Flooring - Laminate\n14/m2\nRemove & relace existing hardboard - existing hardboard has not be installed correctly\nExisting hardboard has not be installed correctly. New hardboard to be nailed & glued\n1/ea",
  "material_breakdown": "",
  "labor_breakdown": "",
  "rooms": "",
  "raw_text": "WORK ORDER: PBG-18191-18039\n \nTo:\nA to Z Flooring Solutions Pty Ltd \nProfile Build Group Pty Ltd\n \n74658650821\n23 Mayneview Street Milton, QLD, 4064\n \n2/133 REDLAND BAY RD Capalaba QLD 4157\nT:\n 07 3638 0304\n \n \nE:\naccounts@profilebuildgroup.com.au\noffice@profilebuildgroup.com.au\nSupervisor:\nPaul White\nABN: 97 783 979 632\nPhone:\n0427 970 055\nQBCC Lic: 15011120 | NSW Lic: 293448C\n \nIssue Date:\n29/05/2025\nClient:\nAuto & General Insurance Services Pty\nLtd\nJob Number: PBG-18191\n \nSITE LOCATION: 28 HILLVIEW AVENUE, Newtown, QLD 4350\nSITE CONTACT: HELEN KANE\nSITE CONTACT PHONE: 0409251687\nATTENDANCE SCHEDULED FOR: 28/04/2025 to 23/05/2025\nIF YOU CAN'T ATTEND AT THIS SCHEDULED TIME YOU NEED TO CONTACT PROFILE BUILD GROUP\nAT LEAST 2 HOURS PRIOR TO ATTENDANCE\nNOTES:\nPBG-18191-18039\nFlooring\nMaterial\nSUNROOM -INTERNAL\nRemove & Replace Flooring - Laminate\n14/m2\nRemove & relace existing hardboard - existing hardboard has not be installed correctly\nExisting hardboard has not be installed correctly. New hardboard to be nailed & glued\n1/ea\nTotals\nTotals\nSubtotal\n$2,959.00\nGST\n$295.90\nTotal\n$3,254.90\nFailure to comply with the below expectations and instructions may result in your invoice being\ndelayed or declined\nATTENDANCE EXPECTATIONS\n1) Please confirm your attendance via return email\n2) All relevant completion certificates must be supplied on invoice\n3) The amount of the purchase order is the agreed fixed price. Any variations will need to be submitted as a\nquotation and approval sought prior to proceeding\n4) Any additional works completed outside of the above scope of works will be declined. No PO = No\nPayment\n5) Before, during and after photos of works must be supplied\n6) All materials to be provided by the subcontractor as per instructions in the Work Order\n7) All works must be completed in accordance with Industry Standards and relevant construction codes.\nFailure to do so will result in a Defect Notice being issued and rectification works to be carried out by the\ntrade.\nInvoicing Instructions:\nAll invoices are to be emailed to accounts@profilebuildgroup.com.au\nPlease ensure photos have been supplied before or at the time of invoicing\nPlease ensure the work order number and full job address is included on the tax invoice\nOnly one purchase work number per tax invoice\n",
  "alternate_contact_name": "",
  "alternate_contact_phone": "",
  "alternate_contact_email": "",
  "alternate_contacts": [],
  "commencement_date": "",
  "installation_date": "",
  "ship_to_name": "HELEN KANE",
  "ship_to_address": "28 HILLVIEW AVENUE, Newtown, QLD 4350",
  "ship_to_address1": "28 HILLVIEW AVENUE",
  "ship_to_address2": "",
  "ship_to_city": "Newtown",
  "ship_to_state": "QLD",
  "ship_to_zip": "4350",
  "ship_to_country": "Australia"
}
