{
  "customer_name": "Unit",
  "business_name": "",
  "first_name": "Unit",
  "last_name": "",
  "address": "P367117 ORDER DATE: 28/05/2025 EXPECTED COMPLETION DATE: 13/06/2025",
  "address1": "P367117 ORDER DATE: 28/05/2025 EXPECTED COMPLETION DATE: 13/06/2025",
  "address2": "",
  "city": "",
  "state": "",
  "zip_code": "",
  "country": "Australia",
  "phone": "0732657381",
  "mobile": "",
  "work_phone": "",
  "home_phone": "",
  "email": "builders@atozflooringsolutions.com.au",
  "customer_type": "Builders",
  "extra_phones": [
    "1300474966"
  ],
  "po_number": "P367117",
  "scope_of_work": "Please note that all final trade invoices must include clear photographs of all safety items supplied or used in the completion of the\nworks listed, including scaffolding, edge rails, safety platforms, harnesses, etc.\nFAILURE TO PROVIDE IMAGES MAY DELAY THE PAYMENT OF THE INVOICE\nUnit 137\nReplace carpet and underlay to match existing.\nM2\n110.00\n5,280.00\n48.00\n5,280.00\n528.00",
  "dollar_value": 5808.0,
  "job_number": "J",
  "actual_job_number": "",
  "supervisor_name": "",
  "supervisor_mobile": "",
  "supervisor_email": "",
  "description_of_works": "Please note that all final trade invoices must include clear photographs of all safety items supplied or used in the completion of the\nworks listed, including scaffolding, edge rails, safety platforms, harnesses, etc.\nFAILURE TO PROVIDE IMAGES MAY DELAY THE PAYMENT OF THE INVOICE\nUnit 137\nReplace carpet and underlay to match existing.\nM2\n110.00\n5,280.00\n48.00\n5,280.00\n528.00",
  "material_breakdown": "",
  "labor_breakdown": "",
  "rooms": "",
  "raw_text": "Supervisor:\nPage 1 of 1\nRizon Group Pty Ltd\nABN: 52-153-718-122\nHead Office Brisbane: Level 1/ 7 Baroona Road, Milton, QLD, 4064\nSydney: 39/11-21 Underwood Road, Homebush, NSW 2140\nclaims@rizon.com.au\nE:\nP: 1300 474 966\nPURCHASE ORDER NO:\nTo:\nClient / Site Details:\nA TO Z FLOORING SOLUTIONS PTY LTD\nP367117\nORDER DATE: 28/05/2025\nEXPECTED COMPLETION DATE: 13/06/2025\nItem Description\nQty\nUnit\nUnit Price\nExtd Price\nMobile:\nATOZFLOO\nChris Giles\nJOB NUMBER: J 610219\n0476 187 998\nAMANDA REIF(MNGER)\n274 ROGHAN ROAD,\nTAIGUM,\nQLD\n4018\nPhone: 0732657381\n2/133 REDLAND BAY ROAD\nCAPALABA QLD 4157\nPhone: 07 3110 0077\nEmail: builders@atozflooringsolutions.com.au\nMelbourne: 57 Roberts Avenue, Mulgrave, VIC 3170\nNewcastle: 4/27 Annie Street, Wickham, NSW 2293\nLicences: QBCC: 1214796 NSW: 283802C Vic: CDB-U52632\nGENERAL CONDITIONS: CLICK HERE\nSCOPE OF WORKS:\nPlease note that all final trade invoices must include clear photographs of all safety items supplied or used in the completion of the\nworks listed, including scaffolding, edge rails, safety platforms, harnesses, etc.\nFAILURE TO PROVIDE IMAGES MAY DELAY THE PAYMENT OF THE INVOICE\nUnit 137\nReplace carpet and underlay to match existing.\nM2\n110.00\n5,280.00\n48.00\n5,280.00\n528.00\nNet Order:\nGST:\nTotal Order:\n5,808.00\nPURCHASE ORDER CONDITIONS:\n1.\n This Purchase Order is to be read in conjunction with the General Conditions, which are available at  \nhttps://www.rizon.com.au/app/uploads/2021/01/PurchaseOrder-GeneralConditions.pdf  or click the link above. Please contact Rizon should \nyou require a hard copy of the General Conditions. Italicised words have the meanings defined in the General Conditions\n2.\nThe Price is the Total Order amount above.\n3.\nThe Works are all of the works listed in the Scope of Works above.\n4.\nThe anticipated Commencement Date is the date no later than 10 days from the date of this Purchase Order or as otherwise notified by \nRizon in accordance with clause 2.3 of the General Conditions.\n5.\nThe anticipated Completion Date is 30 days after the Commencement Date adjusted in accordance with the clause 2.4 of the General \nConditions.\n6.\nThe maximum Material Deposit that Rizon will pay is equal is 10% of the value of the material cost unless otherwise agreed.\n7.\nPayment terms are in accordance with clauses 4.2, 4.3 and 4.4 of the General Conditions. \n8.\nSpecial Conditions in accordance with clause 18 of the General Conditions are set out below: \na.\nThe Purchase Order number must be quoted on all correspondence and notices under the General Conditions including \nProgress Claims (invoices) and only one Purchase Order number is to be included on a Progress Claim (invoice).\nb.\nProgress Claims are to be emailed in PDF format to accounts@rizon.com.au\nc.\nThe Subcontractor must comply with the Site Safety Requirements.\n9.\nBy accepting this PO you confirm that you will conform with all modern slavery obligations under Modern Slavery Act 2018, including in \nyour own operations and through your supply chain. Any suspected incidents of modern slavery are to be reported immediately to Rizon \nand the AFP.\nPage 1 of 1\nPrinted 28/05/2025 4:18:12 PM\n",
  "alternate_contact_name": "",
  "alternate_contact_phone": "",
  "alternate_contact_email": "",
  "alternate_contacts": [],
  "commencement_date": "",
  "installation_date": "",
  "ship_to_name": "",
  "ship_to_address": "",
  "ship_to_address1": "P367117 ORDER DATE: 28/05/2025 EXPECTED COMPLETION DATE: 13/06/2025"
}
