{
  "customer_name": "Nda Realty One Pty Ltd",
  "business_name": "",
  "first_name": "Nda",
  "last_name": "Realty One Pty Ltd",
  "address": "68 Durham Cres, Bray Park, QLD 4500",
  "address1": "68 Durham Cres",
  "address2": "",
  "city": "Bray Park",
  "state": "QLD",
  "zip_code": "4500",
  "country": "Australia",
  "phone": "0433340395",
  "mobile": "",
  "work_phone": "",
  "home_phone": "",
  "email": "narsonreddy@hotmail.com",
  "customer_type": "Builders",
  "extra_phones": [
    "6140143126",
    "98103883",
    "1300827835"
  ],
  "po_number": "PO23218",
  "scope_of_work": "SOLUTIONS\nOrder Number\nPO23218\nOrder Date\n31/10/2024\nJob Number\nI04630\n \n \nPlease quote the above order number in all correspondence for this order\nClient Reference\n6140143126\nSupervisor\nToby Burns\nSite Contact Name\nNda Realty One Pty Ltd\nAtf Nda (Mr Narson\nKundur)\nSupervisor Contact\n0419 731 743\nSite Contact Phone\n0433340395\n Customer Email\nnarsonreddy@hotmail.com\nSite Address\n68 Durham Cres, Bray Park, QLD 4500\n \nStart / Required By\nDate\n31/10/2024\nCompletion Date\n29/11/2024\nAdditional\nNotes/Instructions:\nHi Zoran \nCould you please contact the customer and confirm which flooring he would like\nto use throughout the property so we can get the ball rolling. Any queries please\ngive me a call... \n(Mr Narson Kundur) 0433340395\nPO23218\nFlooring\nENTRY\nLabour for flooring of the following description\nLabour only to fit floating timber flooring and trims. Approximately 7.5 m2\nSpecialist flooring supply. Custom run flooring, parquetry, set up fees etc\nSupply only of 14mm pre-finished floating Merbau flooring and trims, 2mm foam underlay and 200 um moisture barrier.\nApproximately 7.5 m2\nHALL\nLabour for flooring of the following description\nLabour only to fit floating timber flooring and trims. Approximately 10 m2\nSpecialist flooring supply. Custom run flooring, parquetry, set up fees etc\nSupply only of 14mm pre-finished floating Merbau flooring and trims, 2mm foam underlay and 200 um moisture barrier.\nApproximately 10 m2\nT&T Corporation Pty Ltd t/a Townsend Building Services\nABN | 98 103 883 558\nA | Level 1/85 W Burleigh Rd\nBurleigh Heads QLD 4220\nE | tbs.admin@tbs.com.au\nP | 1300 827 835\n \nOPEN PLAN AREA\nLabour for flooring of the following description\nLabour only to fit floating timber flooring and trims. Approximately 61 m2\nSpecialist flooring supply. Custom run flooring, parquetry, set up fees etc\nSupply only of 14mm pre-finished floating Merbau flooring and trims, 2mm foam underlay and 200 um moisture barrier.\nApproximately 61 m2",
  "dollar_value": 14430.0,
  "job_number": "Toby Burns 0419 731 743",
  "actual_job_number": "I04630",
  "supervisor_name": "Toby Burns",
  "supervisor_mobile": "0419 731 743",
  "supervisor_email": "",
  "description_of_works": "SOLUTIONS\nOrder Number\nPO23218\nOrder Date\n31/10/2024\nJob Number\nI04630 Please quote the above order number in all correspondence for this order\nClient Reference\n6140143126\nSupervisor\nToby Burns\nSite Contact Name\nNda Realty One Pty Ltd\nAtf Nda (Mr Narson\nKundur)\nSupervisor Contact\n0419 731 743\nSite Contact Phone\n0433340395 Customer Email\nnarsonreddy@hotmail.com\nSite Address\n68 Durham Cres, Bray Park, QLD 4500 Start / Required By\nDate\n31/10/2024\nCompletion Date\n29/11/2024\nAdditional\nNotes/Instructions:\nHi Zoran Could you please contact the customer and confirm which flooring he would like\nto use throughout the property so we can get the ball rolling. Any queries please\ngive me a call... (Mr Narson Kundur) 0433340395\nPO23218\nFlooring\nENTRY\nLabour for flooring of the following description\nLabour only to fit floating timber flooring and trims. Approximately 7.5 m2\nSpecialist flooring supply. Custom run flooring, parquetry, set up fees etc\nSupply only of 14mm pre-finished floating Merbau flooring and trims, 2mm foam underlay and 200 um moisture barrier.\nApproximately 7.5 m2\nHALL\nLabour for flooring of the following description\nLabour only to fit floating timber flooring and trims. Approximately 10 m2\nSpecialist flooring supply. Custom run flooring, parquetry, set up fees etc\nSupply only of 14mm pre-finished floating Merbau flooring and trims, 2mm foam underlay and 200 um moisture barrier.\nApproximately 10 m2\nT&T Corporation Pty Ltd t/a Townsend Building Services\nABN | 98 103 883 558\nA | Level 1/85 W Burleigh Rd\nBurleigh Heads QLD 4220\nE | tbs.admin@tbs.com.au\nP | 1300 827 835 OPEN PLAN AREA\nLabour for flooring of the following description\nLabour only to fit floating timber flooring and trims. Approximately 61 m2\nSpecialist flooring supply. Custom run flooring, parquetry, set up fees etc\nSupply only of 14mm pre-finished floating Merbau flooring and trims, 2mm foam underlay and 200 um moisture barrier.\nApproximately 61 m2",
  "material_breakdown": "",
  "labor_breakdown": "",
  "rooms": "",
  "raw_text": "PURCHASE ORDER\n \nAssigned To\nA TO Z FLOORING\nSOLUTIONS\nOrder Number\nPO23218\nOrder Date\n31/10/2024\nJob Number\nI04630\n \n \nPlease quote the above order number in all correspondence for this order\nClient Reference\n6140143126\nSupervisor\nToby Burns\nSite Contact Name\nNda Realty One Pty Ltd\nAtf Nda (Mr Narson\nKundur)\nSupervisor Contact\n0419 731 743\nSite Contact Phone\n0433340395\n Customer Email\nnarsonreddy@hotmail.com\nSite Address\n68 Durham Cres, Bray Park, QLD 4500\n \nStart / Required By\nDate\n31/10/2024\nCompletion Date\n29/11/2024\nAdditional\nNotes/Instructions:\nHi Zoran \nCould you please contact the customer and confirm which flooring he would like\nto use throughout the property so we can get the ball rolling. Any queries please\ngive me a call... \n(Mr Narson Kundur) 0433340395\nPO23218\nFlooring\nENTRY\nLabour for flooring of the following description\nLabour only to fit floating timber flooring and trims. Approximately 7.5 m2\nSpecialist flooring supply. Custom run flooring, parquetry, set up fees etc\nSupply only of 14mm pre-finished floating Merbau flooring and trims, 2mm foam underlay and 200 um moisture barrier.\nApproximately 7.5 m2\nHALL\nLabour for flooring of the following description\nLabour only to fit floating timber flooring and trims. Approximately 10 m2\nSpecialist flooring supply. Custom run flooring, parquetry, set up fees etc\nSupply only of 14mm pre-finished floating Merbau flooring and trims, 2mm foam underlay and 200 um moisture barrier.\nApproximately 10 m2\nT&T Corporation Pty Ltd t/a Townsend Building Services\nABN | 98 103 883 558\nA | Level 1/85 W Burleigh Rd\nBurleigh Heads QLD 4220\nE | tbs.admin@tbs.com.au\nP | 1300 827 835\n \nOPEN PLAN AREA\nLabour for flooring of the following description\nLabour only to fit floating timber flooring and trims. Approximately 61 m2\nSpecialist flooring supply. Custom run flooring, parquetry, set up fees etc\nSupply only of 14mm pre-finished floating Merbau flooring and trims, 2mm foam underlay and 200 um moisture barrier.\nApproximately 61 m2\nTotals\nTotals\nSubtotal\n$14,430.00\nGST\n$1,443.00\nTotal\n$15,873.00\n \n \n \n \n \nTownsend Building Services\nPage 2 of 2\nPlease ensure you submit your Invoice via the Invoice Link from the Purchase Order \nemail. If the Link has expired, please email central.accounts@tbs.com.au and we can \nreactivate for you. Please do not email your invoice to townsend.mailer@primeeco.tech \nas our Accounts team will not receive this. Invoice must be in PDF format and include \nour Purchase Order number clearly visible on the Invoice. Failure to do so may result in \ndelayed or non-payment \nPlease Note: The TBS Supervisor/Case Manager for this job must be notified in writing of \nany changes to costing and receive approval, PRIOR to works being completed and your \ninvoice being submitted. \nAll other documents relating to this Order (eg, reports, photos and certifications) should be \nuploaded using the ShareLink on the Purchase Order email or sent to tradedocs@tbs.com.au \nThe sub-contractor remains responsible to undertake site risk assessment as per normal WHS procedures, \nincluding minimising exposure to the COVID-19 virus. Please notify Townsend Building Services in the event \nof potential COVID-19 exposure. \nConditions of Purchase Order: \n\u2022 \nBy accepting to undertake works as outlined within this Purchase Order, you also acknowledge \nacceptance of Terms & Conditions presented within the Townsend Building Services Period \nSubcontract General Conditions which can be found at \nhttps://www.tbs.com.au/s/period_subcontract_terms_and_conditions.pdf. \n\u2022 \nContractors are required to contact the client the day prior to confirm entry. \n\u2022 \nQBCC licenced contractors are reminded of their obligations to only carry out works that is \nincluded within their licence class Scope of Work. You may not carry out, or engage others to \ncarry out, more than $3,300 of incidental work if not licenced to do so. If you consider that this \npurchase order has requested you to carry out works outside of your licencing obligations please \ndo not proceed. Contact your TBS representative for alternative instructions.  \n\u2022 \nWhere any worker suspects that a product to be handled on site contains asbestos or lead paint, \nstop work immediately and contact your TBS representative for further instructions.  \n\u2022 \nContractors are required to clean up on completion of the works; failure to do so may incur a back-\ncharge of associated costs. \n\u2022 \nAny material or colour selection made by our client must have a written agreement from the client, \nconfirmed by your TBS representative, prior to commencement of works. Failure to comply may incur \nrectifications at your cost. \n\u2022 \nAny variation to scope, or extra work requested by our client, including private arrangements between \nour client and you, must be approved in writing by us before work is undertaken. Failure to comply \nwith this condition may result in non-payment of your invoice. \n\u2022 \nAll products and materials must satisfy Australian Standards in quality, safety, performance and \nservice of a product, including product quality guarantees. \n \n",
  "alternate_contact_name": "",
  "alternate_contact_phone": "",
  "alternate_contact_email": "",
  "alternate_contacts": [],
  "commencement_date": "",
  "installation_date": "",
  "ship_to_name": "Name",
  "ship_to_address": "68 Durham Cres, Bray Park, QLD 4500",
  "ship_to_address1": "68 Durham Cres",
  "ship_to_address2": "",
  "ship_to_city": "Bray Park",
  "ship_to_state": "QLD",
  "ship_to_zip": "4500",
  "ship_to_country": "Australia"
}
